Id,SpeakerName,Phrase,translation
2004107001,テトラ,その日、あたしは病を押して、/n初魅と話をするためエデンホールへ向かったのさ。,
2004107002,テトラ,あいにくの天気で、急に雨が降り出してね。/n憂鬱だったよ。,
2004107003,テトラ,だがその道中で、初魅の姿を見かけたのさ。/n――あいつは、傘も差さずに雨に降られてた。,
2004107004,テトラ,ぼんやりした様子で立っていてね。/nあたしは驚いて、すぐ声をかけたよ。,
2004107005,初魅,やあ。,
2004107006,テトラ,あんた……傘持ってないのかい？,
2004107007,初魅,２時間前は降ってなかったからな。,
2004107008,テトラ,２時間もここにいるのか……？,
2004107009,テトラ,こんなところでなに突っ立ってるんだ。,
2004107010,初魅,私も好きでここにいるわけじゃない。,
2004107011,初魅,中に入りたいんだが、少し外出した間に締め出されてね。/n……荷物を置いたままで困ってるんだ。,
2004107012,テトラ,――関係者出口が閉まってる……。,
2004107013,テトラ,なるほどね、誰かが内部から鍵をかけてるのか。,
2004107014,初魅,うっかりした奴だ。/nインターホンを鳴らしても出やしない。,
2004107015,テトラ,……。,
2004107016,初魅,稽古もじき終わる。/nもう少し待ってれば、誰かが出てくるだろ。,
2004107017,テトラ,どうかね。あんたが外で待ってるのを見越して、/n熱心に居残り練習でも始め出すんじゃないかい？,
2004107018,初魅,やる気があるのは結構だな。/n普段からそれくらい熱心に取り組めばいいのに。,
2004107019,テトラ,……鍵なら持ってる。/n開けるよ。,
2004107020,初魅,どうも。,
2004107021,初魅,……貴重品を置いたままだったんで助かったよ。,
2004107022,テトラ,あんた、これからどうするつもりだい？,
2004107023,初魅,このあとか？/n家に帰るつもりだが。,
2004107024,テトラ,そんなずぶ濡れのままでか？/n家だってそれなりに距離はあるだろう。,
2004107025,初魅,まあ、通りすがる人はぎょっとするかもしれないな。,
2004107026,テトラ,そのままじゃ風邪ひくよ。/nついてきな。,
2004107027,,,
2004107028,初魅,風呂を貸してくれてありがとう。,
2004107029,テトラ,身体は温まったかい？,
2004107030,初魅,ああ、世話をかけたね。/n服まで乾かしてもらってすまない。,
2004107031,テトラ,コーヒーを淹れたんだが、砂糖とミルクひとつでよかったかい？,
2004107032,初魅,気を遣わなくていいのに……。/nブラックで構わないよ。,
2004107033,テトラ,悪いね、もう入れちまった。,
2004107034,初魅,……。,
2004107035,テトラ,服が乾くまで、もう少し時間がかかるだろ。/nそれまでおしゃべりに付き合ってくれ。,
2004107036,初魅,こんなに優しくしてくれたんだ、いくらでも付き合うさ。,
2004107037,テトラ,なら、あんたのことを聞かせてくれ。,
2004107038,初魅,ほう、面接の続きかい？,
2004107039,テトラ,さっきは何を考えてたんだ。,
2004107040,初魅,さっき？,
2004107041,テトラ,雨の中立ってた時さ。/nあんなぼんやりした顔は初めて見たからね。,
2004107042,初魅,別に。/n少し……昔のことを思い出していただけだ。,
2004107043,テトラ,銀河座にいた時のことかい？,
2004107044,初魅,いや……違う。,
2004107045,テトラ,役者をやり始めたのは銀河座からかい？/nにしては、あんたの演技からは銀河座らしさを感じないが。,
2004107046,初魅,ああ、演技を人に――,
2004107047,初魅,家族に見せることはよくあった。そのせいかもしれないな。,
2004107048,テトラ,家族に演技を教えてもらったのか？,
2004107049,初魅,いいや、独学だよ。実家が飲食店をやっていてね。/n手伝いながらよく客を観察していた。,
2004107050,テトラ,ふうん、人間観察のたまものってわけか。,
2004107051,初魅,そうとも言える。,
2004107052,テトラ,……。,
2004107053,テトラ,あんたは自分の好きに動かせる劇団が欲しいって言ってたね。/nどうしてだい？,
2004107054,初魅,面接では聞かれなかったことだな。/n答えたほうがいいか？,
2004107055,テトラ,団員から言われたんだよ。あんたのせいで辞める奴が続出してるってね。/n自分が設立した劇団で勝手やられて、黙ってろってか？,
2004107056,テトラ,教えな。なぜそこまでわがままを通そうとするんだ。/nその先に何を求める。なんのためにあんたはこんな騒ぎを起こしてるんだい？,
2004107057,初魅,かつて私の演劇を好きだと言ってくれた人のためだ。/nその人が認めてくれるような芝居がしたい。,
2004107058,初魅,私は、その人のために理想の舞台を作らなきゃいけないんだ。,
2004107059,テトラ,理想……？,
2004107060,初魅,私が観たいのは、未だかつて誰も観たことのないような芝居。/n演者が己をさらけ出し、魂からの演技で舞台を高め合う。,
2004107061,テトラ,魂からの演技、ねぇ……。,
2004107062,初魅,人は知らず、渇き飢えている。だがみんなそのことに気づいていない。/n私はその舞台を見せることで、人々の渇きを癒す。,
2004107063,テトラ,それを言えば、あんたは一番渇いているように見えるが。,
2004107064,初魅,否定はしない。/nだが、あなたも気持ちは同じだろう？　世羅テトラさん。,
2004107065,テトラ,ふん……。,
2004107066,テトラ,誰も観たことがないような舞台をやりたい、その気持ちはわかるよ。/nかつてはあたしもそうだった。そのために、Edenを創ったんだからね。,
2004107067,テトラ,ただ、今のEdenでそれを実現できるかは――,
2004107068,初魅,だが、やってみなければわからない。,
2004107069,,,
2004107070,,,
2004107071,初魅,物事は変化し、繁栄と衰退を繰り返すものだ。/n今のEdenにかつての勢いはないが、私はこのままにしておくつもりはない。,
2004107072,初魅,楽園が朽ちていくのを待つか、私の手で創り変えられるのを見届けるか、/nどちらが良いかは、あなたもわかっているんじゃないか？,
2004107073,,,
2004107074,,,
2004107075,テトラ,……あたしがそれを許すと思っているのかい？,
2004107076,初魅,……許すはずだ。だって、この私を結果的に招き入れたのはあなただからだ。/nあなたは――ひどく渇いているのだから。,
2004107077,テトラ,……。,
2004107078,,,
2004107079,テトラ,あたしは、何も言い返せなかった。/n説得するつもりが、あいつの掌の上だったってわけさ。,
2004107080,テトラ,初魅の言う渇きが何かはわからなかったが、否定はできなかったよ。/nなんせ、出会った時から通じるものを感じていたからね。,
2004107081,テトラ,あたしは結局、あいつに期待しちまってたのさ。,
2004107082,,,
2004107083,容,アタシも気持ちはわかるよ。たくさんの人が辞めていく中、/nEdenに残ったのも、結局は初魅に賭けてみたい気持ちがあったからだ。,
2004107084,テトラ,あとの初魅の行動と、Edenの歴史は、容たちもよく知っているだろう。/n残るメンバーはあいつに従う者だけになり、実質的なリーダーになった。,
2004107085,テトラ,看板役者としてだけじゃない。脚本や芝居の方向性も握っている。/n各地で役者をスカウトし、劇団を好きなように創り変えた。,
2004107086,仁花子,私も、そうしてEdenに招かれたうちのひとり、ってことですよね。,
2004107087,しぐれ,しぐれは自分から来ましたけどね～。/n初魅さんのお芝居、面白そうでしたし♪,
2004107088,テトラ,ああ。あたしが語れるのはこれくらいかね。/n少し、酔いすぎたかな。水を持ってくるよ。,
2004107089,大黒,……待って。/nまだ気になることがあるわ……。,
