Id,SpeakerName,Phrase,translation
2004502001,千歌,じゃあ、内浦観光にしゅっぱ～つ！,那、一起去~逛内浦！
2004502002,心菜,ごめんね、千歌ちゃんたちに案内してもらうような感じになっちゃって……。,抱歉、好像变得要劳烦小千歌带我们参观了……。
2004502003,千歌,ううん！　気にしないで！/n私もこの町のいいところたくさん知ってほしいって思ってるから！,没事！客气什么！/n我也想多多了解这座城市的美妙之处！
2004502004,千歌,じゃあまずは、うちの前の海を見に行こう！,总之、先去我家门前的海边看看吧！
2004502005,伊吕波,あの、千歌ちゃん。/nよかったんですか？　僕たちまでご一緒させていただいてしまって。,那个、小千歌。/n真的好吗？让我们也跟着。
2004502006,千歌,もちろん！　みんなで行ったほうが楽しいし！,不要紧！大家一起玩更开心！
2004502007,梨子,もし途中で気になるところがあったら、別行動とかもありだしね。/n肩ひじ張らずに、気軽に楽しんでね。,要是有什么想去的地方、再分头行动就好啦。/n别有负担、放轻松吧。
2004502008,伊吕波,えへへ、ありがとうございます。/n千歌ちゃん、梨子ちゃん。,欸嘿嘿、谢谢。/n小千歌、小梨子。
2004502009,伊吕波,じゃあ、気を取り直して、内浦観光にレッツゴー！　です！,好、就让我们重整旗鼓、去参观内浦吧！
2004502010,,,
2004502011,千歌,そう！　Aqoursはね、最初は私と、幼馴染の曜ちゃん。/nそれに転校生としてやってきた梨子ちゃんの３人だったんだ。,对！Aqours啊、最开始只有我、我的发小小曜/n以及转校生小梨子三个人哦。
2004502012,心菜,そうなんだ。どうしてスクールアイドルを始めようと思ったの？,这样啊。当初为什么想做学园偶像了呢？
2004502013,千歌,それはね、話すと長くなるんだけど――,这个就、说来话长了—
2004502014,伊吕波,わあっ！　海です！/n姉さん、見てください！　ずっと先まで海が続いてますよっ！,哇！是海哇！/n姐姐、你快看！是一望无际的海哦
2004502015,历,待ってください、伊吕波さん。/n砂浜を走ったら危ないですから、落ち着いて……！,等等、伊吕波。/n在沙滩上奔跑是很危险的、冷静一点……！
2004502016,千歌,あはは、また今度はなそっか。,啊哈哈、下次再说吧。
2004502017,心菜,あはは、うん。,啊哈哈、嗯。
2004502018,心菜,……やっぱり、きれいな海。,……海、果然好漂亮。
2004502019,心菜,ねえ、静香ちゃん。/n海を見ると『悪魔の友人』を思い出すね。,我说、小静香。/n这海能勾起『 恶魔的朋友』的回忆呢。
2004502020,静香,ええ。もうすぐ千秋楽だから、特にね。,嗯。马上就到终演了、感触更深了呢。
2004502021,伊吕波,シリウスの『悪魔の友人』、僕も劇団のみんなと観に行きましたっ！/nひよりとアスモデウスの関係値がすごく良い距離感で！,天狼星演的『 恶魔的朋友』、我和剧团的朋友们也去看了哦！/n日和与阿斯摩太的距离感把握得非常好哦！
2004502022,历,ええ。静香さん演じる悪魔、アスモデウスと、心菜さん演じるひより。/n友人になっていく過程、とても微笑ましかったですわ。,嗯、静香演的恶魔、阿斯摩太与心菜演的日和。/n两个人成为朋友的过程、真叫人会心一笑呢。
2004502023,梨子,このお話ってオリジナルとは少し違うのよね？,这个故事和原著略有出入对吧？
2004502024,初魅,ああ。元は私が私の劇団のために書いた脚本だが、/nシリウス版でアレンジされた部分も素晴らしい内容だった。,嗯、原本是我写给我们剧团的戏、/n但天狼星的改编也十分出色呢。
2004502025,千歌,そうだ！　梨子ちゃんが言ってたんだけど、/n静香ちゃんって『悪魔の友人』のアスモデウスが舞台デビューって本当！？,对了！小梨子说过/n『 恶魔的朋友』是小静香的出道作吧！？
2004502026,静香,えっ？　ええ……。,诶？嗯……。
2004502027,梨子,舞台を観た帰りに調べて知ったんだけどね、/n全然そんな風に見えなかったからびっくりしちゃった。,我看完演出回去查了一下才知道的、/n看表现完全不像是第一次上台 可惊讶了。
2004502028,千歌,ひよりちゃんを守……っ！　あ、ネタバレだから言えないけど、/n静香ちゃんのあのシーンでつい涙が……。,守护日和…！啊、虽然不能剧透、/n总之小静香的那幕可感人了……。
2004502029,静香,……。,……。
2004502030,心菜,あはは、そのくらい静香ちゃんのお芝居が上手だったってことだよね。/nよかったね、静香ちゃん。,啊哈哈、小静香的演技就是那么好哦。/n真是太好了、小静香。
2004502031,静香,……ええ。/nそのくらい作品に入り込んでもらえたのは、嬉しい。,……嗯。/n你们看得开心、我也很高兴。
2004502032,黛雅,劇団電姫の『アラビアンナイト』も素晴らしかったですけれど、/nシリウスの『悪魔の友人』とやらもそんなに面白いんですの？,我知道剧团电姬的『一千零一夜』也演得很棒、/n原来天狼星的『 恶魔的朋友』也那么精彩吗？
2004502033,善子,役者仲間たちがこぞって認めるんだから、間違いなさそうね。,演员之间都互相认可了、肯定没错的。
2004502034,露比,は、初めての舞台でそんなにほめてもらえるなんて、すごいよね。/n今度は、心菜ちゃんと静香ちゃんの演技も観てみたいな。,哈、第一次上台就收获了这么多赞美、好厉害啊。/希望我今后也有机会看看你们的演出呢。
2004502035,伊吕波,ぜひ！　電姫のみんなも観終わるころには本当に涙、涙だったんです！/n静香ちゃんも、心菜ちゃんも皆さん演技がすばらしくて……っ。,务必！电姬的大家在落幕后都哭了、太好哭了！/n小静香、小心菜还有其他人的演技都超棒的……，
2004502036,初魅,私もあの演技には目を見張るものがあった。/nEdenでアスモデウスを演じたしぐれも、珍しく素直に感動していたよ。,那场戏着实令人瞠目啊。/n连在Eden有出演过阿斯摩太的时雨、也深受感动呢。
2004502037,静香,あのしぐれちゃんが……！？/nしりうす湯ではいっつも生意気言ってばっかりなのに……。,小时雨吗……！？/n明明来天狼星浴池的时候总是高高在上的样子……。
2004502038,心菜,ふふ、みんなが静香ちゃんの役者デビューを喜んでくれててよかった。/n静香ちゃん、改めて、デビューおめでとう。,呵呵、大家都很中意小静香的出道演出呢/n小静香。/n再次祝贺你出道。
2004502039,一同,おめでとう！,恭喜！
2004502040,静香,ありがとう。/nまさか旅先でこんな大勢にお祝いされると思わなかった。,谢谢。/n没想到会在旅行的地方被这么多人祝贺呢。
2004502041,静香,（それも、私が何者なのか知らない子たちも一緒に、なんて）,（何况、还有连我是什么存在都不清楚的人、也帮我庆祝）
2004502042,静香,（……嬉しいけど、……本当に、いいのかな）,（……虽然很开心、……但真的、可以吗）
2004502043,露比,あっ、あの、露比たちも観てみたいんですけど、/nまだチケットって取れますか……？,啊、那个、露比她们也想看看来着、/n还能拿到票吗……？
2004502044,心菜,どうだろう？　柊さんたちに聞いてみよっか、静香ちゃん。,怎么说呢？向柊姐问问吗、小静香。
2004502045,静香,そうね、……まあ、もしあったら観に来て。,是呢……嗯、如果有的话就再来吧。
2004502046,千歌,『この揚げパン、美味しい！　うーん、まさに悪魔的☆』,『这个炸面包、超好吃！ 嗯、简直是恶魔级☆』
2004502047,梨子,ち、千歌ちゃん！？,小、小千歌！？
2004502048,千歌,あれっ？　こんなセリフあったよね？,诶？有这台词的对吧？
2004502049,千歌,私、あのシーンのふたりが仲良し！　って感じで好きなんだ。,我、觉得那个场景的两个人非常亲密！超喜欢的
2004502050,心菜,ありがとう！　私も、あのシーンは演じててとっても楽しいんだ。,谢谢！、那个场景我也演得很开心。
2004502051,心菜,えーと、そのセリフの次はね、『それ、流行ってるんですか？』かな？,额—、下一句应该是『那个、很流行吗？』是吧？
2004502052,千歌,すごい！　本物のひよりちゃんだ！！,厉害！小日和如映眼前！！
2004502053,心菜,あはは、そんなに喜んでもらえるとは思わなかった。/n次のセリフはアスモデウスだよね、静香ちゃん。,啊哈哈、没想到你们会这么开心，/n下一句台词是阿斯摩太的了吧、小静香。
2004502054,静香,ええ、そうね。/n……今、演じたりはしないわよ？,嗯、是呢。/n……我现在、可不打算演哦？
2004502055,心菜,えぇっ！？/nいっつも舞台であんなに素敵な演技をしてるのに……。,诶！/n明明在舞台上演得那么出色……。
2004502056,历,まあまあ、板を降りてこんな近くで、突然、となれば/n誰しも恥ずかしくなるものではないですか？,好啦好啦、在台下突然、被这么多人这么近围着、/n谁都会害羞的不是吗？
2004502057,善子,まして、さっきあんだけ持ち上げられたらねえ。/n露比なんて、目キラキラさせてるもの。,也是、被那么激烈地夸赞/n要是露比、眼睛都要冒光了吧。
2004502058,露比,あっ……。ごめんなさい……。,啊……。对不起……。
2004502059,静香,ううん。ほめてもらえるのはうれしい。,没事。你们夸我也叫我很开心。
2004502060,静香,……こちらこそ、ごめんね。,……我才是、不好意思。
2004502061,梨子,……。,……。
TLTitle,第一步用跳的
info,翻译：生姜がない 校对：潮留开 压制：潮留开